{
  "schema": "hci_transaction_request-v1",
  "interface": {
    "DW": 512,
    "AW": 32,
    "BW": 8,
    "UW": 0,
    "IW": 8,
    "EW": 0
  },
  "path": "tb.i_tracer_b",
  "transactions": [
    {
      "seq": 0,
      "cycle": 90,
      "add": "0x1c010000",
      "wen": 0,
      "data": "0x3f3e3d3c3b3a393837363534333231302f2e2d2c2b2a292827262524232221201f1e1d1c1b1a191817161514131211100f0e0d0c0b0a09080706050403020100",
      "be": "0xffffffffffffffff",
      "id": "0x00"
    },
    {
      "seq": 1,
      "cycle": 91,
      "add": "0x1c010040",
      "wen": 0,
      "data": "0x4f4e4d4c4b4a494847464544434241403f3e3d3c3b3a393837363534333231302f2e2d2c2b2a292827262524232221201f1e1d1c411a19181716151413121110",
      "be": "0xffffffffffffffff",
      "id": "0x01"
    },
    {
      "seq": 2,
      "cycle": 92,
      "add": "0x1c010080",
      "wen": 0,
      "data": "0x5f5e5d5c5b5a595857565554535251504f4e4d4c4b4a494847464544434241403f3e3d3c3b3a393837363534333231302f2e2d2c2b2a29282726252423222120",
      "be": "0xffffffffffffffff",
      "id": "0x02"
    }
  ]
}
