{
  "schema": "hci_transaction_request-v1",
  "interface": {
    "DW": 128,
    "AW": 32,
    "BW": 32,
    "UW": 0,
    "IW": 8,
    "EW": 0
  },
  "path": "tb.i_tracer_a",
  "transactions": [
    {
      "seq": 0,
      "cycle": 10,
      "add": "0x1c010000",
      "wen": 0,
      "data": "0x01111111122222222333333334444444",
      "be": "0x3",
      "id": "0x00"
    },
    {
      "seq": 1,
      "cycle": 11,
      "add": "0x1c010010",
      "wen": 0,
      "data": "0x01111111122222222333333334444445",
      "be": "0x3",
      "id": "0x01"
    },
    {
      "seq": 2,
      "cycle": 12,
      "add": "0x1c010020",
      "wen": 0,
      "data": "0x01111111122222222333333334444446",
      "be": "0x3",
      "id": "0x02"
    }
  ]
}
