{
  "schema": "hci_transaction_request-v1",
  "interface": {
    "DW": 32,
    "AW": 32,
    "BW": 8,
    "UW": 0,
    "IW": 8,
    "EW": 0
  },
  "path": "tb.i_tracer_b",
  "transactions": [
    {
      "seq": 0,
      "cycle": 37,
      "add": "0x1c010000",
      "wen": 0,
      "data": "0xdead0000",
      "be": "0xf",
      "id": "0x00"
    },
    {
      "seq": 1,
      "cycle": 39,
      "add": "0x1c010004",
      "wen": 0,
      "data": "0xdead1111",
      "be": "0xf",
      "id": "0x01"
    },
    {
      "seq": 2,
      "cycle": 41,
      "add": "0x1c010008",
      "wen": 0,
      "data": "0xdead2222",
      "be": "0xf",
      "id": "0x02"
    },
    {
      "seq": 3,
      "cycle": 43,
      "add": "0x1c01000c",
      "wen": 0,
      "data": "0xdead3333",
      "be": "0xf",
      "id": "0x03"
    },
    {
      "seq": 99,
      "cycle": 44,
      "add": "0x1c010100",
      "wen": 0,
      "data": "0xcafebabe",
      "be": "0xf",
      "id": "0x63"
    },
    {
      "seq": 4,
      "cycle": 45,
      "add": "0x1c010010",
      "wen": 0,
      "data": "0xdead4444",
      "be": "0xf",
      "id": "0x04"
    },
    {
      "seq": 5,
      "cycle": 47,
      "add": "0x1c010014",
      "wen": 0,
      "data": "0xdead5555",
      "be": "0xf",
      "id": "0x05"
    },
    {
      "seq": 6,
      "cycle": 49,
      "add": "0x1c010018",
      "wen": 0,
      "data": "0xdead6666",
      "be": "0xf",
      "id": "0x06"
    },
    {
      "seq": 7,
      "cycle": 51,
      "add": "0x1c01001c",
      "wen": 0,
      "data": "0xdead7777",
      "be": "0xf",
      "id": "0x07"
    }
  ]
}
